{
  "$schema": "../packages/schemas/theme-tokens.schema.json",
  "name": "DreamB / Daylight",
  "version": "1.3.2",
  "colors": {
    "background": "#0B0E14",
    "text": "#E6EDF3",
    "accent": "#9B87F5"
  },
  "motion": {
    "enabled": true,
    "durations": {
      "fast": 120,
      "base": 200,
      "slow": 320
    }
  }
}
